<?xml version="1.0"?>

<xs:schema xmlns:xs="http://www.w3.org/2001/XMLSchema"
           targetNamespace="http://la2j.org"
           xmlns="http://la2j.org"
           elementFormDefault="qualified">

    <xs:include schemaLocation="stat.xsd"/>

    <xs:element name="itemList">
        <xs:complexType>
            <xs:choice>
                <xs:element name="item" type="xmlTypeItemStat" minOccurs="0" maxOccurs="unbounded"/>
            </xs:choice>
        </xs:complexType>

    </xs:element>

    <xs:complexType name="xmlTypeItemStat">
        <xs:sequence>
            <xs:element name="stat" type="xmlTypeStat" minOccurs="0" maxOccurs="unbounded"/>
        </xs:sequence>
        <xs:attribute name="id" type="xs:int" use="required"/>
        <xs:attribute name="name" type="xs:string" use="required"/>
    </xs:complexType>

</xs:schema>