<?xml version='1.0' encoding='utf-8'?>

<itemList xmlns:xsi="http://www.w3.org/2001/XMLSchema-instance"
          xmlns="http://la2j.org" xsi:schemaLocation="http://la2j.org ../item.xsd">

    <item id='9100' name="Shadow Item: Magestic Boots">

        <stat function='add' value='49' order='16' name='PHYSIC_DEFENCE'/>

    </item>
    <item id='9101' name="Shadow Item: Magestic Robe">

        <stat function='add' value='147' order='16' name='PHYSIC_DEFENCE'/>
        <stat function='add' value='718' order='96' name='MAX_MP'/>

    </item>
    <item id='9102' name="Shadow Item: Magestic Gauntlet">

        <stat function='add' value='49' order='16' name='PHYSIC_DEFENCE'/>

    </item>
    <item id='9103' name="Shadow Item: Magestic Boots">

        <stat function='add' value='49' order='16' name='PHYSIC_DEFENCE'/>

    </item>
    <item id='9128' name="Shadow Item: Mithril Gauntlet">

        <stat function='add' value='36' order='16' name='PHYSIC_DEFENCE'/>

    </item>
    <item id='9138' name="Santa\'s Hat">

        <stat function='add' value='0' order='16' name='PHYSIC_DEFENCE'/>

    </item>
    <item id='9145' name="Little Angel Wings - For Event">

        <stat function='add' value='0' order='16' name='PHYSIC_DEFENCE'/>

    </item>
    <item id='9158' name="Gold Circlet - For Event">

        <stat function='add' value='0' order='16' name='PHYSIC_DEFENCE'/>

    </item>
    <item id='9159' name="Silver Circlet - For Event">

        <stat function='add' value='0' order='16' name='PHYSIC_DEFENCE'/>

    </item>
    <item id='9160' name="Medievalue Leather Cap - For Event">

        <stat function='add' value='0' order='16' name='PHYSIC_DEFENCE'/>

    </item>
    <item id='9177' name="Teddy Bear Hat - Blessed Scroll of Resurrection">

        <stat function='add' value='0' order='16' name='PHYSIC_DEFENCE'/>

    </item>
    <item id='9178' name="Piggy Hat - Blessed Scroll of Resurrection">

        <stat function='add' value='0' order='16' name='PHYSIC_DEFENCE'/>

    </item>
    <item id='9179' name="Jester Hat - Blessed Scroll of Resurrection">

        <stat function='add' value='0' order='16' name='PHYSIC_DEFENCE'/>

    </item>
    <item id='9180' name="Wizard\'s Hat - Blessed Scroll of Resurrection">

        <stat function='add' value='0' order='16' name='PHYSIC_DEFENCE'/>

    </item>
    <item id='9181' name="Dapper Cap - Blessed Scroll of Resurrection">

        <stat function='add' value='0' order='16' name='PHYSIC_DEFENCE'/>

    </item>
    <item id='9182' name="Romantic Chapeau - Blessed Scroll of Resurrection">

        <stat function='add' value='0' order='16' name='PHYSIC_DEFENCE'/>

    </item>
    <item id='9183' name="Iron Circlet - Blessed Scroll of Resurrection">

        <stat function='add' value='0' order='16' name='PHYSIC_DEFENCE'/>

    </item>
    <item id='9184' name="Teddy Bear Hat - Blessed Scroll of Escape">

        <stat function='add' value='0' order='16' name='PHYSIC_DEFENCE'/>

    </item>
    <item id='9185' name="Piggy Hat - Blessed Scroll of Escape">

        <stat function='add' value='0' order='16' name='PHYSIC_DEFENCE'/>

    </item>
    <item id='9186' name="Jester Hat - Blessed Scroll of Escape">

        <stat function='add' value='0' order='16' name='PHYSIC_DEFENCE'/>

    </item>
    <item id='9187' name="Wizard\'s Hat - Blessed Scroll of Escape">

        <stat function='add' value='0' order='16' name='PHYSIC_DEFENCE'/>

    </item>
    <item id='9188' name="Dapper Cap - Blessed Scroll of Escape">

        <stat function='add' value='0' order='16' name='PHYSIC_DEFENCE'/>

    </item>
    <item id='9189' name="Romantic Chapeau - Blessed Scroll of Escape">

        <stat function='add' value='0' order='16' name='PHYSIC_DEFENCE'/>

    </item>
    <item id='9190' name="Iron Circlet - Blessed Scroll of Escape">

        <stat function='add' value='0' order='16' name='PHYSIC_DEFENCE'/>

    </item>
    <item id='9191' name="Teddy Bear Hat - Big Head">

        <stat function='add' value='0' order='16' name='PHYSIC_DEFENCE'/>

    </item>
    <item id='9192' name="Piggy Hat - Big Head">

        <stat function='add' value='0' order='16' name='PHYSIC_DEFENCE'/>

    </item>
    <item id='9193' name="Jester Hat - Big Head">

        <stat function='add' value='0' order='16' name='PHYSIC_DEFENCE'/>

    </item>
    <item id='9194' name="Wizard\'s Hat - Big Head">

        <stat function='add' value='0' order='16' name='PHYSIC_DEFENCE'/>

    </item>
    <item id='9195' name="Dapper Hat - Big Head">

        <stat function='add' value='0' order='16' name='PHYSIC_DEFENCE'/>

    </item>
    <item id='9196' name="Romantic Chapeau - Big Head">

        <stat function='add' value='0' order='16' name='PHYSIC_DEFENCE'/>

    </item>
    <item id='9197' name="Iron Circlet - Big Head">

        <stat function='add' value='0' order='16' name='PHYSIC_DEFENCE'/>

    </item>
    <item id='9198' name="Teddy Bear Hat - Firework">

        <stat function='add' value='0' order='16' name='PHYSIC_DEFENCE'/>

    </item>
    <item id='9199' name="Piggy Hat - Firework">

        <stat function='add' value='0' order='16' name='PHYSIC_DEFENCE'/>

    </item>
</itemList>