<?xml version='1.0' encoding='utf-8'?>
<itemList xmlns:xsi="http://www.w3.org/2001/XMLSchema-instance"
          xmlns="http://la2j.org" xsi:schemaLocation="http://la2j.org ../item.xsd">

    <item id='3900' name="Wolf's Luxury Plate">

        <stat function='add' order='16' name='PHYSIC_DEFENCE' value='43'/>
        <stat function='add' order='16' name='MAGIC_DEFENCE' value='38'/>

    </item>
    <item id='3901' name="Wolf's Mithril Armor">

        <stat function='add' order='16' name='PHYSIC_DEFENCE' value='47'/>
        <stat function='add' order='16' name='MAGIC_DEFENCE' value='41'/>

    </item>
    <item id='3912' name="Hatchling's Soft Leather">

        <stat function='add' order='16' name='PHYSIC_DEFENCE' value='26'/>
        <stat function='add' order='16' name='MAGIC_DEFENCE' value='26'/>

    </item>
    <item id='3913' name="Hatchling's Scale Mail">

        <stat function='add' order='16' name='PHYSIC_DEFENCE' value='29'/>
        <stat function='add' order='16' name='MAGIC_DEFENCE' value='29'/>

    </item>
    <item id='3914' name="Hatchling's Brigandine">

        <stat function='add' order='16' name='PHYSIC_DEFENCE' value='31'/>
        <stat function='add' order='16' name='MAGIC_DEFENCE' value='31'/>

    </item>
    <item id='3915' name="Hatchling's Bronze Coat">

        <stat function='add' order='16' name='PHYSIC_DEFENCE' value='33'/>
        <stat function='add' order='16' name='MAGIC_DEFENCE' value='33'/>

    </item>
    <item id='3916' name="Hatchling's Steel Coat">

        <stat function='add' order='16' name='PHYSIC_DEFENCE' value='36'/>
        <stat function='add' order='16' name='MAGIC_DEFENCE' value='36'/>

    </item>
    <item id='3917' name="Hatchling's Shadowplate">

        <stat function='add' order='16' name='PHYSIC_DEFENCE' value='38'/>
        <stat function='add' order='16' name='MAGIC_DEFENCE' value='38'/>

    </item>
    <item id='3918' name="Hatchling's Mithril Coat">

        <stat function='add' order='16' name='PHYSIC_DEFENCE' value='41'/>
        <stat function='add' order='16' name='MAGIC_DEFENCE' value='41'/>

    </item>
</itemList>