<?xml version='1.0' encoding='utf-8'?>

<itemList xmlns:xsi="http://www.w3.org/2001/XMLSchema-instance"
          xmlns="http://la2j.org" xsi:schemaLocation="http://la2j.org ../item.xsd">

    <item id='6834' name="Circlet of Innadrill">

        <stat function='add' value='0' order='16' name='PHYSIC_DEFENCE'/>

    </item>
    <item id='6835' name="Circlet of Dion">

        <stat function='add' value='0' order='16' name='PHYSIC_DEFENCE'/>

    </item>
    <item id='6836' name="Circlet of Goddard">

        <stat function='add' value='0' order='16' name='PHYSIC_DEFENCE'/>

    </item>
    <item id='6837' name="Circlet of Oren">

        <stat function='add' value='0' order='16' name='PHYSIC_DEFENCE'/>

    </item>
    <item id='6838' name="Circlet of Gludio">

        <stat function='add' value='0' order='16' name='PHYSIC_DEFENCE'/>

    </item>
    <item id='6839' name="Circlet of Giran">

        <stat function='add' value='0' order='16' name='PHYSIC_DEFENCE'/>

    </item>
    <item id='6840' name="Circlet of Aden">

        <stat function='add' value='0' order='16' name='PHYSIC_DEFENCE'/>

    </item>
    <item id='6841' name="Crown of Lord">

        <stat function='add' value='0' order='16' name='PHYSIC_DEFENCE'/>

    </item>
    <item id='6842' name="Wings of Destiny Circlet">

        <stat function='add' value='0' order='16' name='PHYSIC_DEFENCE'/>

    </item>
    <item id='6843' name="Cat Ear">

        <stat function='add' value='0' order='16' name='PHYSIC_DEFENCE'/>

    </item>
    <item id='6844' name="Lady's Hair Pin">

        <stat function='add' value='0' order='16' name='PHYSIC_DEFENCE'/>

    </item>
    <item id='6845' name="Pirate's Eye Patch">

        <stat function='add' value='0' order='16' name='PHYSIC_DEFENCE'/>

    </item>
    <item id='6846' name="Monocle">

        <stat function='add' value='0' order='16' name='PHYSIC_DEFENCE'/>

    </item>
</itemList>