<?xml version='1.0' encoding='utf-8'?>
<itemList xmlns:xsi="http://www.w3.org/2001/XMLSchema-instance"           xmlns="http://la2j.org" xsi:schemaLocation="http://la2j.org ../item.xsd">
<item id='1142' name="rusted_bronze_sword">

    <stat function='add' value='18' order='8' name='PHYSIC_ATTACK'/>
    <stat function='add' value='21' order='8' name='MAGIC_ATTACK'/>
    <stat function='add' value='8' order='8' name='CRITICAL_RATE'/>
    <stat function='add' value='0' order='16' name='ACCURACY'/>
    <stat function='add' value='379' order='8' name='PHYSIC_ATTACK_SPEED'/>
    <stat function='enchant' value='0' order='12' name='PHYSIC_ATTACK'/>
    <stat function='enchant' value='0' order='12' name='MAGIC_ATTACK'/>

</item>
<item id='1181' name="netis_bow">

    <stat function='add' value='45' order='8' name='PHYSIC_ATTACK'/>
    <stat function='add' value='16' order='8' name='MAGIC_ATTACK'/>
    <stat function='add' value='12' order='8' name='CRITICAL_RATE'/>
    <stat function='add' value='-3' order='16' name='ACCURACY'/>
    <stat function='add' value='293' order='8' name='PHYSIC_ATTACK_SPEED'/>
    <stat function='enchant' value='0' order='12' name='PHYSIC_ATTACK'/>
    <stat function='enchant' value='0' order='12' name='MAGIC_ATTACK'/>

</item>
<item id='1182' name="netis_dagger">

    <stat function='add' value='19' order='8' name='PHYSIC_ATTACK'/>
    <stat function='add' value='16' order='8' name='MAGIC_ATTACK'/>
    <stat function='add' value='12' order='8' name='CRITICAL_RATE'/>
    <stat function='add' value='-3' order='16' name='ACCURACY'/>
    <stat function='add' value='433' order='8' name='PHYSIC_ATTACK_SPEED'/>
    <stat function='enchant' value='0' order='12' name='PHYSIC_ATTACK'/>
    <stat function='enchant' value='0' order='12' name='MAGIC_ATTACK'/>

</item>
</itemList>