<?xml version='1.0' encoding='utf-8'?>
<itemList xmlns:xsi="http://www.w3.org/2001/XMLSchema-instance" xmlns="http://la2j.org"
          xsi:schemaLocation="http://la2j.org ../item.xsd">
    <item id='7560' name="monster_only_(fishing_rod)">

        <stat function='add' value='1' order='8' name='PHYSIC_ATTACK'/>
        <stat function='add' value='1' order='8' name='MAGIC_ATTACK'/>
        <stat function='add' value='0' order='8' name='CRITICAL_RATE'/>
        <stat function='add' value='-3' order='16' name='ACCURACY'/>
        <stat function='add' value='325' order='8' name='PHYSIC_ATTACK_SPEED'/>
        <stat function='enchant' value='0' order='12' name='PHYSIC_ATTACK'/>
        <stat function='enchant' value='0' order='12' name='MAGIC_ATTACK'/>

    </item>
    <item id='7575' name="draconic_bow">

        <stat function='add' value='581' order='8' name='PHYSIC_ATTACK'/>
        <stat function='add' value='132' order='8' name='MAGIC_ATTACK'/>
        <stat function='add' value='12' order='8' name='CRITICAL_RATE'/>
        <stat function='add' value='-3' order='16' name='ACCURACY'/>
        <stat function='add' value='293' order='8' name='PHYSIC_ATTACK_SPEED'/>
        <stat function='enchant' value='0' order='12' name='PHYSIC_ATTACK'/>
        <stat function='enchant' value='0' order='12' name='MAGIC_ATTACK'/>

    </item>
    <item id='7576' name="draconic_bow_cheap_shot">

        <stat function='add' value='581' order='8' name='PHYSIC_ATTACK'/>
        <stat function='add' value='132' order='8' name='MAGIC_ATTACK'/>
        <stat function='add' value='12' order='8' name='CRITICAL_RATE'/>
        <stat function='add' value='-3' order='16' name='ACCURACY'/>
        <stat function='add' value='293' order='8' name='PHYSIC_ATTACK_SPEED'/>
        <stat function='enchant' value='0' order='12' name='PHYSIC_ATTACK'/>
        <stat function='enchant' value='0' order='12' name='MAGIC_ATTACK'/>
        <!-- SA: Cheap Shot -->
        <stat function='set' value='1' order='8' name='MP_CONSUME'>
            <conditions>
                <and>
                    <game kind="skill" value="false"/>
                    <game kind="chance" value="26"/>
                </and>
            </conditions>
        </stat>
        <!-- Enhances damage to target during PvP -->
        <stat function='mul' value='1.05' order='48' name='PVP_PHYSIC_DAMAGE'/>
        <stat function='mul' value='1.05' order='48' name='PVP_MAGIC_DAMAGE'/>

    </item>
    <item id='7577' name="draconic_bow_focus">

        <stat function='add' value='581' order='8' name='PHYSIC_ATTACK'/>
        <stat function='add' value='132' order='8' name='MAGIC_ATTACK'/>
        <stat function='add' value='12' order='8' name='CRITICAL_RATE'/>
        <stat function='add' value='-3' order='16' name='ACCURACY'/>
        <stat function='add' value='293' order='8' name='PHYSIC_ATTACK_SPEED'/>
        <stat function='enchant' value='0' order='12' name='PHYSIC_ATTACK'/>
        <stat function='enchant' value='0' order='12' name='MAGIC_ATTACK'/>
        <!-- SA: Focus -->
        <stat function='add' value='88' order='64' name='CRITICAL_RATE'/>
        <!-- Enhances damage to target during PvP -->
        <stat function='mul' value='1.05' order='48' name='PVP_PHYSIC_DAMAGE'/>
        <stat function='mul' value='1.05' order='48' name='PVP_MAGIC_DAMAGE'/>

    </item>
    <item id='7578' name="draconic_bow_critical_slow">

        <stat function='add' value='581' order='8' name='PHYSIC_ATTACK'/>
        <stat function='add' value='132' order='8' name='MAGIC_ATTACK'/>
        <stat function='add' value='12' order='8' name='CRITICAL_RATE'/>
        <stat function='add' value='-3' order='16' name='ACCURACY'/>
        <stat function='add' value='293' order='8' name='PHYSIC_ATTACK_SPEED'/>
        <stat function='enchant' value='0' order='12' name='PHYSIC_ATTACK'/>
        <stat function='enchant' value='0' order='12' name='MAGIC_ATTACK'/>
        <!-- Enhances damage to target during PvP -->
        <stat function='mul' value='1.05' order='48' name='PVP_PHYSIC_DAMAGE'/>
        <stat function='mul' value='1.05' order='48' name='PVP_MAGIC_DAMAGE'/>
        <!-- SA: Critical Slow -->
        <skill triggerType='onCrit' id='3594' chance='7'/>

    </item>
</itemList>
