<?xml version='1.0' encoding='utf-8'?>

<itemList xmlns:xsi="http://www.w3.org/2001/XMLSchema-instance"
          xmlns="http://la2j.org" xsi:schemaLocation="http://la2j.org ../item.xsd">

    <item id='5170' name="Mithril Panzer Coat">

        <stat function='add' order='16' name='PHYSIC_DEFENCE' value='41'/>
        <stat function='add' order='16' name='MAGIC_DEFENCE' value='41'/>

    </item>
    <item id='5171' name="Brigadine Panzer Coat">

        <stat function='add' order='16' name='PHYSIC_DEFENCE' value='44'/>
        <stat function='add' order='16' name='MAGIC_DEFENCE' value='44'/>

    </item>
    <item id='5172' name="Draconic Panzer Coat">

        <stat function='add' order='16' name='PHYSIC_DEFENCE' value='46'/>
        <stat function='add' order='16' name='MAGIC_DEFENCE' value='46'/>

    </item>
    <item id='5173' name="Blood Panzer Coat">

        <stat function='add' order='16' name='PHYSIC_DEFENCE' value='49'/>
        <stat function='add' order='16' name='MAGIC_DEFENCE' value='49'/>

    </item>
    <item id='5174' name="Ophidian Panzer Coat">

        <stat function='add' order='16' name='PHYSIC_DEFENCE' value='52'/>
        <stat function='add' order='16' name='MAGIC_DEFENCE' value='52'/>

    </item>
    <item id='5175' name="Inferno Panzer Coat">

        <stat function='add' order='16' name='PHYSIC_DEFENCE' value='54'/>
        <stat function='add' order='16' name='MAGIC_DEFENCE' value='54'/>

    </item>
    <item id='5182' name="Hatchling's Gorgon Coat">

        <stat function='add' order='16' name='PHYSIC_DEFENCE' value='44'/>
        <stat function='add' order='16' name='MAGIC_DEFENCE' value='44'/>

    </item>
    <item id='5183' name="Hatchling's Ophidian Plate">

        <stat function='add' order='16' name='PHYSIC_DEFENCE' value='46'/>
        <stat function='add' order='16' name='MAGIC_DEFENCE' value='46'/>

    </item>
    <item id='5184' name="Hatchling's Crimson Plate">

        <stat function='add' order='16' name='PHYSIC_DEFENCE' value='49'/>
        <stat function='add' order='16' name='MAGIC_DEFENCE' value='49'/>

    </item>
    <item id='5185' name="Hatchling's Draconic Plate">

        <stat function='add' order='16' name='PHYSIC_DEFENCE' value='52'/>
        <stat function='add' order='16' name='MAGIC_DEFENCE' value='52'/>

    </item>
    <item id='5186' name="Hatchling's Inferno Plate">

        <stat function='add' order='16' name='PHYSIC_DEFENCE' value='54'/>
        <stat function='add' order='16' name='MAGIC_DEFENCE' value='54'/>

    </item>
</itemList>