<?xml version='1.0' encoding='utf-8'?>

<itemList xmlns:xsi="http://www.w3.org/2001/XMLSchema-instance"
          xmlns="http://la2j.org" xsi:schemaLocation="http://la2j.org ../item.xsd">

    <item id="21" name="Shirt">
        <stat function="add" order="10" val="36">PHYSIC_DEFENCE</stat>
    </item>

    <item id='21' name="Shirt">
        <stat function="add" val='36' order='10'>PHYSIC_DEFENCE</stat>
    </item>

    <item id='22' name="Leather Shirt">
        <stat function="add" val='43' order='10'>PHYSIC_DEFENCE</stat>
    </item>

    <item id='23' name="Wooden Breastplate">
        <stat function="add" order='10' val='47'>PHYSIC_DEFENCE</stat>
    </item>

    <item id='24' name="Bone Breastplate">
        <stat function="add" val='50' order='10'>PHYSIC_DEFENCE</stat>
    </item>

    <item id='25' name="Piece Bone Breastplate">
        <stat function="add" val='62' order='10' >PHYSIC_DEFENCE</stat>
    </item>

    <item id='26' name="Bronze Breastplate">
        <stat function="add" val='68' order='10' >PHYSIC_DEFENCE</stat>
    </item>

    <item id='27' name="Hard Leather Shirt">
        <stat function="add" val='53' order='10' >PHYSIC_DEFENCE</stat>
    </item>

    <item id='28' name="Pants">
        <stat function="add" val='22' order='10' >PHYSIC_DEFENCE</stat>
    </item>

    <item id='29' name="Leather Pants">
        <stat function="add" val='27' order='10' >PHYSIC_DEFENCE</stat>
    </item>

    <item id='30' name="Hard Leather Pants">
        <stat function="add" val='29' order='10' >PHYSIC_DEFENCE</stat>
    </item>

    <item id='31' name="Bone Gaiters">
        <stat function="add" val='32' order='10' >PHYSIC_DEFENCE</stat>
    </item>

    <item id='32' name="Piece Bone Gaiters">
        <stat function="add" val='39' order='10' >PHYSIC_DEFENCE</stat>
    </item>

    <item id='33' name="Hard Leather Gaiters">
        <stat function="add" val='33' order='10' >PHYSIC_DEFENCE</stat>
    </item>

    <item id='34' name="Bronze Gaiters">
        <stat function="add" val='43' order='10' >PHYSIC_DEFENCE</stat>
    </item>

    <item id='35' name="Cloth Shoes">
        <stat function="add" val='9' order='10' >PHYSIC_DEFENCE</stat>
    </item>

    <item id='36' name="Leather Sandals">
        <stat function="add" val='9' order='10' >PHYSIC_DEFENCE</stat>
    </item>

    <item id='37' name="Leather Shoes">
        <stat function="add" val='13' order='10' >PHYSIC_DEFENCE</stat>
    </item>

    <item id='38' name="Low Boots">
        <stat function="add" val='15' order='10' >PHYSIC_DEFENCE</stat>
    </item>

    <item id='39' name="Boots">
        <stat function="add" val='17' order='10' >PHYSIC_DEFENCE</stat>
    </item>

    <item id='40' name="Leather Boots">
        <stat function="add" val='19' order='10' >PHYSIC_DEFENCE</stat>
        <stat function="enchant" val='0' order='12'>PHYSIC_DEFENCE</stat>
    </item>

    <item id='41' name="Cloth Cap">
        <stat function="add" val='13' order='10' >PHYSIC_DEFENCE</stat>
    </item>

    <item id='42' name="Leather Cap">
        <stat function="add" val='16' order='10' >PHYSIC_DEFENCE</stat>
    </item>

    <item id='43' name="Wooden Helmet">
        <stat function="add" val='19' order='10' >PHYSIC_DEFENCE</stat>
    </item>

    <item id='44' name="Leather Helmet">
        <stat function="add" val='23' order='10' >PHYSIC_DEFENCE</stat>
    </item>

    <item id='45' name="Bone Helmet">
        <stat function="add" val='29' order='10' >PHYSIC_DEFENCE</stat>
        <stat function="enchant" val='0' order='12' >PHYSIC_DEFENCE</stat>
    </item>

    <item id='46' name="Bronze Helmet">
        <stat function="add" val='33' order='10' >PHYSIC_DEFENCE</stat>
        <stat function="" val='0' order='12' >PHYSIC_DEFENCE</stat>
    </item>

    <item id='47' name="Helmet">
        <stat function="add" val='37' order='10' >PHYSIC_DEFENCE</stat>
        <stat function="enchant" val='0' order='12' >PHYSIC_DEFENCE</stat>
    </item>

    <item id='48' name="Short Gloves">
        <stat function="add" val='9' order='10' >PHYSIC_DEFENCE</stat>
    </item>

    <item id='49' name="Gloves">
        <stat function="add" val='13' order='10' >PHYSIC_DEFENCE</stat>
    </item>

    <item id='50' name="Leather Gloves">
        <stat function="add" val='15' order='10' >PHYSIC_DEFENCE</stat>
    </item>

    <item id='51' name="Bracer">
        <stat function="add" val='17' order='10' >PHYSIC_DEFENCE</stat>
    </item>

    <item id='52' name="Hemp Cloak">
        <stat function="add" val='2' order='10' >PHYSIC_DEFENCE</stat>
    </item>

    <item id='53' name="Cotton Cloak">
        <stat function="add" val='3' order='10' >PHYSIC_DEFENCE</stat>
    </item>

    <item id='54' name="Silk Cloak">
        <stat function="add" val='4' order='10' >PHYSIC_DEFENCE</stat>
    </item>

    <item id='55' name="Cotton Undergarment">
        <stat function="add" val='4' order='10' >PHYSIC_DEFENCE</stat>
    </item>

    <item id='56' name="Wool Undergarment">
        <stat function="add" val='5' order='10' >PHYSIC_DEFENCE</stat>
    </item>

    <item id='58' name="Mithril Breastplate">
        <stat function="add" val='95' order='10' >PHYSIC_DEFENCE</stat>
        <stat function="enchant" val='0' order='12' >PHYSIC_DEFENCE</stat>
    </item>

    <item id='59' name="Mithril Gaiters">
        <stat function="add" val='61' order='10' >PHYSIC_DEFENCE</stat>
        <stat function="enchant" val='0' order='12' >PHYSIC_DEFENCE</stat>
    </item>

    <item id='60' name="Composite Armor">
        <stat function="add" val='224' order='10' >PHYSIC_DEFENCE</stat>
        <stat function="enchant" val='0' order='12' >PHYSIC_DEFENCE</stat>
    </item>

    <item id='61' name="Mithril Gloves">
        <stat function="add" val='29' order='10' >PHYSIC_DEFENCE</stat>
        <stat function="enchant" val='0' order='12' >PHYSIC_DEFENCE</stat>
    </item>

    <item id='62' name="Mithril Boots">
        <stat function="add" val='32' order='10' >PHYSIC_DEFENCE</stat>
        <stat function="enchant" val='0' order='12' >PHYSIC_DEFENCE</stat>
    </item>

    <item id='63' name="Gauntlets">
        <stat function="add" val='24' order='10' >PHYSIC_DEFENCE</stat>
        <stat function="enchant" val='0' order='12' >PHYSIC_DEFENCE</stat>
    </item>

    <item id='64' name="Composite Boots">
        <stat function="add" val='36' order='10' >PHYSIC_DEFENCE</stat>
        <stat function="enchant" val='0' order='12' >PHYSIC_DEFENCE</stat>
    </item>

</itemList>